audio_id,transcription,detected_language
../data/audios\6854715107394555141,"Republican political ads from the South that read like a skip from SNL, Part 7. I'm Marjorie Green and I approve this ad. America is the greatest country in the world. We need conservatives in Washington that will keep it that way. I'm running to stop gun control. Democrats fight for their socialist agenda every single day. I'll fight even harder to stop them. I'm Marjorie Green, Republican for Congress. Save America, Stop Socialism.",en
../data/audios\6854973598017359110,"A sixth grade teacher asked her class the other day how many of them were Trump fans. And most of them not knowing what a Trump fan was and of course wanting to be liked by their teacher, they all raised their hands. Well, all except for little Johnny. The teacher looks over at little Johnny and says, Johnny, why are you being different again? And he says, well, because I'm not a Trump fan. And she says, well, why are you not a Trump fan? And he says, because I'm a Democrat. She says, really, why are you a Democrat? He says, well, my mom's a Democrat and my dad's a Democrat, so I'm a Democrat. She says, oh, really? Well, what if your mom was a moron and your dad was an idiot? What would that make you? Johnny smiles and says, a Trump fan.",en
../data/audios\6854989774722321670,"I agree with and support the statement. I do not support the movement. I'm about to ether your shit. The founders of the BLM organization have literally come out and said that they are Marxists. We don't necessarily want to be the vanguard of this movement. The person that you guys get that quote from doesn't even want to be the leader of the movement. Next. And that would explain why BLM is a trend. As you can see here, it spikes in 2016, an election year, and then quite literally flatlines until 2020. And this line on the very right literally predicts that it's going to take a steep decline because it doesn't really matter to people. Let's look at that graph you cited there. A spike in July 2016. What could have happened then? It's not like Del Ron Small, Alton Sterling, and Philando Castile were all shot within days of each other, which would explain the fucking spike. And if we zoom out once, we realize that the spike starts in 2013, not an election year. It flattens out again because A, this is only Google search. And B, there wasn't too many outrageous cases in this time frame. It spiked again in 2020 because halfway through the year, we've had riots, George Floyd, Ahmaud Arbery, Breonna Taylor, a pandemic, and the right wing trying to discredit it, which would get people Googling. If we look at related subjects, three of the five are a result of bullshit talking points from the right. And it'll drop off again because when you hear it so much, you lose the need to Google it. Fuck out of you.",en
../data/audios\6855008587853368582,So our president is the greatest troll that this nation has ever known if you go to Donald J Trump calm it takes you here his website But if you type in a bunch of random characters afterwards like this It takes you here,en
../data/audios\6855050995630738694,Is Trump going to win? Is Trump going to win? No. Trump is not going to win.,en
../data/audios\6855318837991099654,E E Dollar dollar bill come get her Even your man know n***a,en
../data/audios\6855336257556352261,That's clown shit.,en
../data/audios\6855441978893651205,"White people in America are automatically racist. And before you con- White people in America, okay. You understand that every culture since the beginning of time has succeeded off of racism or slavery, right? Even the Africans. Monsomoussa, the richest man of all time, was an African who gained his wealth off of slavery. Nonetheless, you don't want to talk about your possible lineage in relation to him, do you? You only want to talk about your relation to American slavery, which is great. I'm glad you brought that up. The Irish, the Italians, the Russians, and the Polish all suffered the fate of racism and poor treatment in the 1920s in America when coming over here trying to make a better life for themselves. So how is it that only black people can experience racism when four or five different cultures of white people have experienced the same hardships that they have within the same century? And if you want to talk about privilege, you see how easy it was for you to unload a bullshit theory and have it somewhat accepted. Yet if I say something, I'll be called a racist because it's inherent, right?",en
../data/audios\6855444480238062853,"Yeah, what can I- Boy, I'm gonna stop you right there. You might want to pick them damn pants up. It'll help you run faster. HONEY, GO GET MY SHOTGUN!",en
../data/audios\6855450523097763077,"You know, I don't care what your fucking race is, what your political affiliation is, if you are not fucking upset, if you do not mourn the death of every individual who did not need to die by the hands of the police, you're a fucking monster. You can't just want people to just fucking live because every single one of these people, every single fucking victim of police brutality was a person. They weren't just somebody's sister, brother, mother, cousin, aunt, uncle, they were a fucking person. They had life and I thought you valued that. All lives matter, right? Fucking act like it.",en
../data/audios\6855451162359991557,"Alright, so go to DonaldJTrump.com and it pulls up his website. Donald Trump, there he is. If you go back up here, okay, and then you type a bunch of random letters, whatever, and then it entered.",en
../data/audios\6855689670202789126,"Call me crazy, but if I see a TikTok video of you supporting our president Donald J. Trump and our military and our flag and our law enforcement, you just earned yourself a follow.",en
../data/audios\6855728537719147781,"Breaking news, President Trump praises doctor who warns of alien DNA sex with demons. These are headlines that I never dreamed I would read in my career as a news anchor, but yet here we are.",en
../data/audios\6855873827507916037,"Guys, I just thought of a genius idea. What if we bought one of these Trump stores, blacked out all the windows so they couldn't see what was inside, and then filled it with a bunch of liberal merch like an AOC bobblehead or like Black Lives Matter shirts or like Chasm for First Gentleman.",en
../data/audios\6856017714431954181,"Perdona, perdona, perdona. ¿Sabes qué? Estas son las 5 cosas de hoy. Trump ha dicho que va a prohibir TikTok en Estados Unidos por seguridad nacional, mientras Microsoft está intentando comprar la aplicación. ¿Os acordáis del hackeo que hubo la semana pasada a las cuentas de Twitter de algunos famosos? Se ha detenido a una adolescente de 17 años por ser el responsable y se enfrenta a 30 cargos de delitos graves. Rusia asegura que ya ha acabado las pruebas de su primera vacuna contra el coronavirus y se están preparando para una campaña masiva en octubre. Cuidado con la nueva estafa que roba los datos de tu tarjeta de crédito haciéndose pasar por Netflix. Los hackers se envían un email en nombre de Netflix pidiendo que se actualicen los datos personales de los usuarios y así es como llevan a cabo la estafa. Huawei se convierte en el principal vendedor de teléfonos inteligentes en el mundo gracias a la pandemia.",es
../data/audios\6856082927307083013,"Christians voting for Democrats in 2020 are perhaps the stupidest people on the entire planet. In 2008 at the Democrat National Convention, they literally booed God. They booed God himself. Just a few short weeks ago, they tried to cancel Jesus Christ this. Now, I'm noticing a reoccurring theme of demonic activity around the Democrat Party, but you don't care because Trump said such mean things in his tweet. Wake up! The Democrats are coming for us, and if you vote them into power, you will deserve the persecution that's coming our way.",en
../data/audios\6856157190445632773,"So, Duh, it was on the news today Donald Trump is trying to ban TikTok in the states. The fuck is wrong with him? I can't do that. I am on TikTok all the time. Fuck him telling him to go to Russia.",en
../data/audios\6856442392971611398,"In April 2011, my platoon and I were living in PB Rogers, now ZAD, Afghanistan. It was named after a staff sergeant who had just passed. On this specific day, it had been quiet, which is nice, except it gives your imagination more time to think about tomorrow. It was almost evening when we heard a loud... very spooky, especially since no one from our platoon was outside the wire. A Marine at one of our guard posts spotted the dust still coming down at an abandoned village two clicks to our northwest. We were hoping it was a Taliban. They had blown themselves up trying to put another IED in the ground. But within five minutes, my entire squad was ordered to run to the town as fast as we could. The whole time I was running, I was afraid of what I might step on. I wasn't even thinking about the nightmare I was about to see.",en
../data/audios\6856504927313841413,"Now that Epstein lady's busted, Bill Clinton's going down! Good. Huh? If Bill Clinton had anything to do with Jeffrey Epstein, they should throw his ass in jail. But he's your boy! He's a Democrat! So what? Well then, Hillary's probably gonna go to jail too! Good. That's the difference between you and me. You know, if a Democrat breaks the law, I think they should go to jail. Damn right! But no matter what kind of laws Republicans are caught breaking, you guys just circle the wagons and defend their every action like you're in some kind of brain-dead cult. But he's a Democrat!",en
../data/audios\6856566115510914310,"I think that Donald Trump thinks that if the 2020 election is delayed, it means that he gets to stay in office indefinitely, which is not true. His term ends January 20th, 2021, no matter what. Mike Pence's term ends the same day. The next person in the line of succession after the Vice President is the Speaker of the House, but if the election doesn't happen in time, there is no House of Representatives and therefore no Speaker. The next in the line of succession is the President Pro Tempore of the Senate, typically the longest serving member of the majority party in the Senate, currently Chuck Grassley. But if the election doesn't happen, all of the seats that are in contention would be left empty, leaving 35 Democrats and 30 Republicans. And with the new majority, the President Pro Tempore and subsequently the President of the United States would be Senator Patrick Leahy of Vermont.",en
../data/audios\6857144610104413445,"Young man, why don't you stand up and introduce yourself? Who's the fat kid talking to? You, Patrick, she's the teacher! Oooh!",en
../data/audios\6857226682797985029,"Here we go. Will Trump win the election in 2020? Will Trump win the election in 2020? No. No, he will not.",en
../data/audios\6857572417909411077,"I went through this sound and bullied every Trump supporter I saw for half an hour. I'm getting vibes y'all. You barely have lips yet you use them to say this? Alright Sandra, get off this kid's app. It's anti-American to wear the flag is closed. You're allowed to wear it. I just corrected her. You have 20% left. Keep it pushing dad. When your hair leaves the year 2009, we can talk. Obama is still your hair's president. Karen, the kids are waiting for you to pick them up. Your hair is five different. So you're part of the LGBT community. Congrats on coming out. She said she loves law enforcement while she breaks the law. You damn skippy. Oh skippy. Not the 1920 glasses. Girl your hair is as dead as your brain.",en
../data/audios\6857773364539313414,"Oh, numerous categories were lower than the world, lower than Europe. Here's case death. Oh, you're doing death as a proportion of cases. I'm talking about death as a proportion of population. That's where the U S is really bad. Well, much worse than Korea, Germany, et cetera. You can't, you can't do that. You have to, you have to.",en
../data/audios\6857979921088662789,"We just don't think you need to have an AR-15 rifle in your house. Up up up! Second Amendment! Second Amendment! Oh, you mean this thing? You wanna uphold the amendments in this? Okay, let's take a look at it. Number one, freedom of assembly. A couple of weeks ago, a concert honoring the life of Elijah McClain was broken up by the police who used tear gas. Well, number four, no illegal searches or seizures. Stop and frisk laws allow the police to detain and search you for drugs out of pure suspicion, even if you don't possess anything. Okay, but number six, the right to a speedy trial. In July of 2008, Joseph Togano III was charged with marijuana distribution. And despite him pleading his right to this specific amendment, he had to wait a whole seven years before his case even saw the light of day. Okay, but that doesn't have anything to do- Dude, I thought this thing was like your Bible. If you're gonna pounce when one of these amendments are violated, why aren't you pouncing when nearly all of them are? Because- Could it be that you only get upset when these violations inconvenience you personally or...",en
../data/audios\6858014018393722118,I was running through the six where my walls,en
../data/audios\6858218425731370246,A lot of Republicans won't wear a face mask because we told them it helps other people. We should have said it hurts immigrants.,en
../data/audios\6858292609643826437,Please stand for the playing of our national anthem.,en
../data/audios\6858298646262238469,"Tweets from Donald Trump that are really just fucking stupid. Part 1. While our wonderful president was out playing golf all day, the TSA is falling apart, just like our government. It's freezing and snowing in New York. We need global warming. I have never seen a thin person drinking diet coke. Bitch. Wait a minute. Yeah.",en
../data/audios\6858309437103295750,"Don't believe me? I'm not the only advocate. Look at all the people he's fired. Unleash the cabinet! We come from the cabinet of people Trump aspired. Well actually just five of them, there's 70 more inside it. We all came to Washington excited and inspired, and found out on our Twitter feeds that our time had expired. Well I for one think this administration's a safe bet. The president hasn't fired me, yet. No, Trump's a stellar friend and a stand-up man. And if he dares to double-cross me, I have a backup plan. Enough! Did anyone invite Donald Trump to this meeting? I'd like to hear what he has to say.",en
../data/audios\6858397328928181509,"Trump just gave us a huge update on TikTok. As you know, TikTok has 45 days to sell. The only reason it has not been banned yet is because of my favorite TikTokker, at Checkmurf Proud. Get him to 25K and the deal will get done very soon.",en
../data/audios\6859131828847086854,"See this fella right here? That's me. Gulf War, 1990. This fella right here? That's me. So basically, I've spent the large part of my adult life defending our country, defending those in it, and providing a valuable service as far as supplying a natural resource to power homes and businesses. You'll also notice one other thing. I've worked my entire life. I've worked hard for what I have. Now you expect me to vote somebody in office so you can have what you want without sacrificing anything? Yeah, see how that works. Trump 2020.",en
../data/audios\6859166877864774917,"Do you know why I pulled you over today, sir? I don't know you tell me. My tags is current. I wasn't speaking. I'm assuming it's because I'm black. Are you insinuating that I'm a racist? That's seriously offensive right now. And what's so offensive about that? A couple things. I was born in Vallejo, California. I resided there until I was 18 years old. College Park to be exact. I'm not even capable of seeing you as anything other than a human. Two, you left your tailgate down and your cooler fell out back there on California wall bash. Oh hell no! It's in the street! No, no. We picked it up for you. It's in the cruiser. I taxed you a soda.",en
../data/audios\6859210677781843206,"to growing up, they wanted to be like Trump. Beyonce and Jay-Z were sipping poolside at Mar-a-Lago. He was the dream. Obama said, his candidacy for the White House, he became a racist, bigoted, homophobic, sexist, rapist at one point, right? Hell yeah, Candace Owen spits facts, and the left does not like her at all because she tells the truth, and the truth offends a lot of crybabies. Yeah, Trump 2020.",en
../data/audios\6859626007175941382,"Donald Trump möchte sein Gesicht am Mount Rushmore verewigen lassen. Und ich zeig euch am Ende von diesem Video, wie das aussehen könnte. TikTok News, mit Nico. Am Mount Rushmore findet man die Gesichter von vier der wichtigsten US-Präsidenten. Klar, dass unser Donald da nicht fehlen möchte. Und jetzt machen alle TikTokker, die Donald Trump passen, das Herz rot und drücken einmal auf Fluss. Von Trumps angeblichen Plänen berichtet die Zeitung New York Times. Trump selbst bezeichnet die ganze Geschichte übrigens als Fake News. Lässt aber durchfliegen, dass er es gar nicht so schlecht fände. Auf Twitter gab es die ersten Reaktionen und so könnte das Ganze aussehen.",de
../data/audios\6859840375125839110,"Hi, this is Things I Don't Understand. World debt. Don't get it. We made it. Why can't we just fix it? Like, that doesn't make sense to me. So this is an actual problem, but it's not so simple. The world has a debt of about $352 trillion. For normal debt, like you owing money to a friend, you either pay it back or file for bankruptcy. But for government, debt is more complicated. The U.S. government has $25 trillion in debt and every year they pay some of it off. But the problem is we spend more money than we make from taxes so the debt goes up. For example, in 2019, the U.S. made about $3.5 trillion from taxes, but it ended up spending about $4.5. So we added a trillion dollars in debt. That's spending from things like the military, which cost us $700 billion a year, or things like Medicaid, Social Security, and other things that add trillions more. So if we got rid of these things, we could slowly cut the debt, but a lot of people like and depend on these things. So another option is to increase taxes, but in 2017, Donald Trump lowered taxes, which is predicted to add over $2 trillion in debt. So the only other options are basically to either not pay anyone back or just to print tons of money, both of which aren't great ideas. So basically, we can fix the debt, but when everyone wants great benefits with no taxes, it's hard to do.",en
../data/audios\6859849411397209350,"Why should President Trump come see your show? Well, I hope he doesn't because I won't perform if he does. Really? Really. Tell me why. Because I hate the motherfucker. How's that?",en
../data/audios\6860084040486210821,"Remember when you were afraid that Ebola would come here? But Obama stopped it, then started a pandemic team that actually had an office in Wuhan, China. Did you know that Obama had the CDC working on a vaccine five days after H1N1 hit? Yeah, it took this dude 72 days to do anything about COVID. The first case hit America January 20th. Trump's travel ban that he brags about was on January 31st. The virus is already here and it had a European fucking passport. On top of that, he didn't ban anything. People from Hong Kong and Macau were exempt. Flight records show that more than 5,600 Chinese and foreign nationals from China flew to the US in February, 2100 in March. But here's the party never talks about. He was told about the virus in November. He didn't care. Our intelligence, however, cared so much, they told NATO and the Israelis in November. We locked down in March. We're told by Dr. Fauci, the leading virologist in the world, that if we open up cases, they could go out of control. And here we are. Cases.",en
../data/audios\6860208699839909126,I was protecting Elena.,en
../data/audios\6860315501512363270,"Well, what, why isn't black white just being an Asian Indian? Why is it different? You know when people said save the turtles? Everyone was like, yeah, we'll stop using plastic straws because the turtles are really being hurt by these plastic materials in the ocean. And no one said, yeah, well, what about the seal lives? Or yeah, but what about the shark's lives? Shark lives matter too. No one's saying that. They just realized that one group of a specific area is being really affected by something and it needs to be changed. That means they want change to make things better for everyone, not just that one group, but to make changes to the system so that everyone is equal in the eyes of the law. But do you really think that black people are equal? No, they're not. Why? There are so many studies that show that there are still race disparities in the",en
../data/audios\6860327456906202373,"Tall, Large, Henry the 8th, yeah that didn't work out.",en
../data/audios\6860460372676136197,"Wipe it down, wipe, wipe.",en
../data/audios\6860492525854051590,"You have one new message. Hey, this is Phil from the Small Weiner Club. Sorry to get back to you so late. I just finished reviewing your application and information you sent in, but I am sorry to say that I don't think I can allow you to join our group. From what I'm looking at, your wiener is massive. I mean, the sheer girth and juiciness alone is ridiculous. It looks as if somebody glued a forearm to the bottom of your torso. You could probably stand on it like a tripod. And that's not even mentioning how fat your nuts are. But it does appear that you're going to have to take that ginormous schmeat somewhere else. But thank you for trying and best of luck to you.",en
../data/audios\6860511796827081989,"So is Trump a big winner or is he a spoiled brat who grew up in the lap of luxury had his daddy sign his checks and Then bragged about how he is a huge winner Trump's three biggest crowds are evangelicals conservatives, and he's a winner voters Trump is lying to all of them stop buying the lies",en
../data/audios\6860537907602558213,"People are waking up. People are changing. Humans are naturally conservative. Because we're humans. You grow up being told to work hard for what you got. You don't grow up being told you're going to get something because you just want it. You saying, like, you ain't got to work for it. When I went in the store, and I tried to get a Snickers and they had no money for it, I'm going to slap my hand, spit that Snickers back. You feel me? You can't afford that. You know what I'm saying? But Democrats, they say, hey, we give you everything for free. That ain't reality. Because nothing is free because we pay for everything with our taxes. They work for us. It was Donald Trump who woke me up, man. At first, when he was nominated and he was elected, I was not a big fan. But to see the things he's done for the black community, to see things he's done for America in particular, I'm a huge fan now and he has my support for more years. And I'll be voting for Donald J. Trump. See you there.",en
../data/audios\6860914703942569222,"And listen, I know, I know that us reasonable Americans don't want to go out and vote for that man, Mr. Biden. But this is how I put it. You know, Joe Biden talked about how police were shooting people in the heart and they were shooting to kill, right? And he said, what if we shot people in the leg? And listen, it's a terrible thing to say because we shouldn't be shooting people, period, like they are. The police are, they need to be defended. They are a corrupt organization. They were slave catchers anyway. Agree. But I took that moment and I said, you know what, that is the, that's the full representation of this election. It's the heart or the leg. And with Donald Trump, it's the heart. We all getting shot in the heart. But with Joe Biden, honey, it's leg 2020 and I got a vote for leg 2020.",en
../data/audios\6860947830371142918,"if you regret it all, all the lying sign you have!",en
../data/audios\6861276102023793926,"Well, TikTok, I just came out of Walmart and apparently I'm parked right next to that bitch Karen that everybody speaks of. I'm guessing my hat triggered her because I shit you not, she walks by me and yells, fuck Trump. Yeah, one of those. But, it turns out I ordered an extra couple of these just for this kind of occasion, so... No, Karen. Fuck you.",en
../data/audios\6861600226310999301,"See that? There's your Black Lives Matter! How come you aren't marching in the streets with that poor boy, you hypocrites? Oh my god, that's terrible. Did they arrest the guy who did it? Damn straight! So is he gonna get like a slap on the wrist and maybe two weeks paid leave from his job? Hell no! He's gonna be in jail the rest of his natural born life! What about the cops who killed Breonna Taylor? Have they been arrested? Huh? What about the three other cops that helped kill George Floyd? Or the cops that killed Sander Bland? Or Eric Garner? Or Elijah McClain? Or Michael Brown? Or the cops that killed- Now hold on! You're missing the point, son! One of us is definitely missing the point.",en
../data/audios\6861618166192262405,"That's why yo mama dead? Dead as hell. What shoes she got on? She got on her casket. That's why yo granny ain't got no knees, and she can't pray to Jesus, bitch.",en
../data/audios\6861959719129468165,"people. We're in for sympathy. We're not asking for charity. We are just asking for equality. Fairness for justice. That is everything. Everything that people are asking for is getting interpreted in a very different way. No, it's simple. We want equality.",en
