audio_id,transcription,detected_language
../data/audios\6746590978280279301,"Do you know what Dab Me Up is? Do you know what Dab Me Up is? Okay, so you have to go like that. That's how you Dab Me Up. Dab Me Up! Woo! The way we do it in my neighborhood, we go like this. You walk up, you go like this. Oh, can we do that? No, no, let's do it. You go this, this. No, no, keep it even. You're too old. This, this, and then this. This, okay, okay. Then this. You got it? I got it. Good to see you. Good to see you too.",en
../data/audios\6748582567995378949,"Go ahead, go ahead. No, not you, not you. Your organization's terrible. Your organization's terrible. Let's go. Go ahead. Quiet, quiet. Go ahead, she's asking a question. Don't be rude. Don't be rude. No, I'm not going to give you a ques- I'm not going to give you a question. You are fake news.",en
../data/audios\6752944407395175686,There's not any.,en
../data/audios\6755172553632926981,"If I give you one message to hold in your hearts today, it's this. Treat the word impossible as nothing more than motivation. Relish the opportunity to be an outsider because it's the outsiders who change the world and who make a real and lasting difference.",en
../data/audios\6758547542276852998,"What? Did I kill them, sir? Are you kidding me?",en
../data/audios\6759058155272965381,"What's going on now is the single greatest scam in the history of American politics. The Democrats want to take away your guns. They want to take away your healthcare. They want to take away your vote. They want to take away your freedom. They want to take away your judges. They want to take away everything. We can never let this happen. We're fighting to drain the swamp, and that's exactly what I'm doing. And you see why we have to do it. Because our country is at stake like never before. It's all very simple. They're trying to stop me because I'm fighting for you, and I'll never let that happen.",en
../data/audios\6759592971953327365,"I know Mr. Fonick you had a few quick questions for the ambassador Yield to you. Mr. Fonick. Thank you. Mr. Nunez ambassador Yovanovich. Thank you for being here today The gentlewoman was suspend. What is the interruption for this time? It is our time the gentlewoman was suspend. You're not recognized. Mr. Nunez You were my council. I just recognized under the House Residence 660 You are not allowed to yield time except a minority count ranking member yielded time another member of Congress That is not accurate you're gagging the that is accurate Ambassador Yovanovich, I want to thank you for being here today. You're not recognized This is the fifth time you have interrupted members of Congress The gentlewoman will suspend Mr. Chair, we control the time It's been customary this committee that whoever controls the time Can yield to whoever they wish if we have members of Congress that have a few questions Seems appropriate that we'd be able to let Mr. Fonick",en
../data/audios\6764365112364076293,"So Barack Obama, Hillary Clinton, and Nancy Pelosi were all in an airplane with a pilot. And Obama says, I'm going to take this $100 bill, throw it out the airplane, and make one American happy. Hillary Clinton says, I'm going to take that $100 bill, Obama, and I'm going to split it in two and make two Americans happy. Nancy Pelosi says, I'm going to take those $250s, Hillary. I'm going to make them $101 bills and make 100 Americans happy. The pilot goes, how about I throw all three of you out the airplane and make every American happy?",en
../data/audios\6764504823481109765,"Alexa, who's the President of the United States? The United States President is Donald Trump.",en
../data/audios\6764983068668333318,This barbaric...,en
../data/audios\6767012149236600070,"that you work hard for what you want in life. That your word is your bond, that you do what you say you're going to do. That you treat people with dignity and respect because we want our children and all children in this nation to know that the only limit to the height of your achievements is the reach of your dreams and your willingness to work hard for them.",en
../data/audios\6767438501068754182,"Oh, I stepped in shit.",en
../data/audios\6768354102876458245,"Guys, my retainer gives me the weirdest lisp when I talk with it. Watch how it sounds when I say the word trash. Democrats.",en
../data/audios\6769885035374988549,,en
../data/audios\6770054795723050246,"Since Syria, Iraq, and Afghanistan, Trump has taken us out of Turkey, he's taken us out of Syria, he killed the leader of ISIS, he created 6 million plus jobs, he has grown the GDP plus 50 to 100 points per year, the stock market is hitting brand new records each week, how naive I am, I am, how naive I am, the funny thing is the Democrats are grasping at it trying to impeach him for nothing, for nothing, he's one of the greatest presidents in American history.",en
../data/audios\6771161534275046662,"This man is so racist, why is he giving $100 billion to the low-income community? He's so racist. And he's so racist, why he's the president that reopened back funding for HBCUs? So you're 100% for Trump? 150,000%. Damn, all right, nigga. Who would you be for, Obama? What did he do? I'll wait. You tell me one thing he did. Oh, but he's racist, but yet he signed into law the general form law that freed over 4,000 people, 97% were black. But he's racist, though. This is what racists do. This is the new era of racism. I need that racism. I like it. I like it. If that's racist, let me get more of that. Facts!",en
../data/audios\6771231129975491845,"...since Syria, Iraq, and Afghanistan, Trump is taking us out of Turkey, he's taking us out of Syria, he killed the leader of ISIS, he created 6 million plus jobs, he has grown the GDP plus 50 to 100 points per year, the stock market is hitting brand new records each week... I just love how naive you are about that. How naive I am? I am? How naive I am? The funny thing is the Democrats are grasping at it trying to...",en
../data/audios\6771276995037875462,You know your mama go whoop your ass and she see this video I FUCK DRUMP Hey listen so Imma pass you the mic And then I want you to state your name one more time And yell out fuck Donald Trump as loud as you can And at the end I want you to say hi mom FUCK DONALD TRUMP FUCK DONALD TRUMP FUCK DONALD TRUMP FUCK DONALD TRUMP,en
../data/audios\6771562298327764230,"Why do you support the president? Because he's the man! I love that. Why is he the man? Because he protects all my rights. My first, my second, my third, my fourth, my fifth, all of them. Sounds like you've been a long time Trump supporter. I have not been. I did not vote for him 2016, but I didn't vote for Hillary Addams, so don't judge me. So what made you change your mind? He kept his words. And he kept it real. You know, when other politicians were saying other things and not keeping their rhetoric, he kept his word. And so, safe to say you'll be voting on him in 2020? Absolutely.",en
../data/audios\6771960739432385798,"Okay, what's this whole impeachment thing about? In summer 2019, Trump straight up asked Ukraine to interfere in our 2020 elections by digging up dirt on his political rival, Joe Biden. Biden's son Hunter worked with a Ukrainian oil and gas company called Burisma. Trump was hoping that if Ukrainian President Zelensky said they were investigating Hunter, it would make his dad look bad, even if it was based on nothing. Even worse, Trump also purposely withheld $400 million in taxpayer money from Ukraine as a bargaining chip to force them to do his personal favor. This matters because Ukraine is fighting Russia and needs that military aid. When someone in the administration blew the whistle on him, Trump immediately released the aid and tried to cover it up. Exploiting the unique privileges of your role as president is called abuse of power. Trump also tried to obstruct the inquiry by deterring key witnesses from testifying, burying documents, and harassing witnesses who did testify. On Twitter, of course. So, the House impeached Trump for abuse of power and obstruction of Congress, making him only the third president in U.S. history to be impeached. But that doesn't mean he'll be removed from office. That power rests with the Senate, where it would take at least 20 Republicans voting with Democrats to remove Trump from office. The House impeached Trump for abuse of power and obstruction of Congress, making him only the third president in U.S. history to be impeached.",en
../data/audios\6771972405695941893,"Hey guys, so you might have seen in the news today that Trump did get impeached And I want to do a very quick video just explaining what that means So first impeachment does not mean he's kicked out So I'm gonna try to keep things very very simple and explain what just happened and what's happening next So long story short there are two steps to get a president kicked out First step is the house votes to impeach second step is the Senate votes to kick him out So for the first step the house has 430 voting members and the numbers here matter only 216 votes are needed for impeachment and since the Democrats won in 2018 there are 232 Democrats in the house So it was a pretty easy win but now the second step is the Senate for Trump to be removed he needs 67 votes from the Senate against him and In 2018 the Republicans won the Senate so in the Senate there are 53 Republicans and 45 Democrats Remember they need 67 votes So to kick out Trump the Democrats have to convince 22 out of the 53 Republicans to remove him from office Historically speaking there were two other presidents that got impeached, but neither got kicked out. We'll see what happens",en
../data/audios\6772668269594676486,I can't talk. What do I do?,en
../data/audios\6774202034888494342,"Personally now the news person Okay, that's cool. How many people you know? Okay, how many people you know to how many people you know? How many people you know? How many people you know? None, I mean, you know one. I mean, you know",en
../data/audios\6774536897747307781,"My opinions are just as important as those who were born before me. I know I am young, but I know what I'm saying. I'm sick of your thoughts and I'm sick of your praying. Children are being slaughtered in numbers. Mothers and fathers losing sons and daughters. We blame the Muslims and the Jewish instead of the ones who actually do it. This song is an attack. It's a eulogy in the memory of those now living. A proclamation to the older generation that doesn't understand that the Second Amendment isn't protection. It's a death sentence, a defendant's a gun, and the convicted is innocent. It's ironic, isn't it? A country more loyal to a law made in 1791. An entire nation led by a hand that holds a gun. This isn't a war where weapons will get the job done unless we do something. Kids, it's time to learn to run.",en
../data/audios\6775900332447812869,Sophie looks like Melania Trump. What? What? Sophie? Sophie looks like Melania Trump.,en
../data/audios\6777844082757602566,"I didn't say anything. Oh God, I'm not gonna hit you. Oh God, I'm not gonna touch you. Oh God, I'm not gonna hit you. You're not gonna touch me. No. You're gonna go home. Oh God. On God. On God. Let go. Bitch, I don't believe in God, you stupid hoe.",en
../data/audios\6777863676742421765,"Our president will start a war with Iran because he has absolutely no ability to negotiate. He's weak and he's ineffective. So the only way he figures that he's going to get reelected and as sure as you're sitting there is to start a war with Iran. Now, I'm more militant and more militaristic than the president. I believe in strength. But to start a war in order to get elected, and I believe that's going to happen, would be an outrage.",en
../data/audios\6778591131790740742,"So let me get this straight, guys. We take out one of the leading terrorists in the world. The left has a whiny butt meltdown, and they send condolences to and side with the terrorists, and then all of a sudden now the Iranian government offers an $80 million bounty for the person that can bring them the head of President Donald Trump. Have you lost your ever-loving mind? Do you realize President Donald Trump, regardless of where you fall on the political spectrum, is going to win the next election by an unbelievable landslide? We could wipe Iran off the map without a sneeze before breakfast tomorrow morning, and they know that. We don't negotiate with terrorists, and if you side with the terrorists, you're an enemy to America.",en
../data/audios\6780046301083077894,"Alexa, is World War 3 going to happen? Probably not. Donald Trump will most likely pull out like his parents should have done 73 years ago.",en
../data/audios\6780432622469254406,"If you do that, I'm gonna do that. If you do that, I'm gonna do that. If you do this, I'm gonna do that. What if I just do it? You don't wanna do that.",en
../data/audios\6780787884136893701,"I wish there were some real men around here, you know? Oh, you read my mind, girlfriend. More time, so I stay. Dance for me, dance for me, dance for me. Oh, oh.",en
../data/audios\6784825179278232837,"Can a public school suspend you for wearing a pro-Trump t-shirt? No, in Oregon, the Hillsboro School District paid $25,000 to a student. It suspended for wearing a pro-Trump t-shirt after the federal courts found this to be a violation of the First Amendment.",en
../data/audios\6786020706023984390,"I am so tired of hearing white people this, white people that. No white person alive today owned a slave and no black person alive today was ever a slave. Stop being a victim, stop loving white people for your problems and just do better.",en
../data/audios\6786612982823603461,This big dog will fight when you rattle his cage And you'll be safe,en
../data/audios\6788153393752902918,Can a public school ban you from wearing clothing that supports gun ownership and Second Amendment rights? No. A Wisconsin federal judge recently barred a public school from being able to ban students from wearing clothing that supports gun ownership and Second Amendment rights because it would violate the First Amendment.,en
../data/audios\6790381442741374213,He's impeached forever. No matter what he says or whatever headlines he wants to carry around. You're impeached forever. You're never getting rid of that scar.,en
../data/audios\6790821411058502918,"So when you take food stamps away from poor people like myself, we hurt even more. And on top of that, two days ago we get a letter in the mail saying that my wife and my two children, including myself, no longer have insurance thanks to Trump's new policies. So we have to go through this very long and tedious procedure to try to get insurance again. Now mind you, I have a son who has a disability and they just canceled our insurance due to Trump's policies. So I don't understand how you guys think Trump's making America great again. Maybe it's for the middle class and the higher class because he's bringing more money to you, but the money that you're receiving is from us poor people. So how about for once you stop and don't think about money. Think about those that are out there suffering because like myself and all of those other poor people.",en
../data/audios\6791485582032768261,"So if you ever have a really good picture but annoying things like light switches are in the way, I use this app called Retouch. All you do is download it, use the little brush tool, and you can literally erase anything from any picture. I use this on so many of my photos. This is before and after. And I'm also going to show you this pretty sunset picture.",en
../data/audios\6791495074325794053,"You know, one of my favorite things that Republicans like to say is this. You know what we have in the United States that nobody in the world has? Freedom. Oh really? Well let's check that out. Here's a list of the 36 most free countries in the world. Hmm. I don't see the United States anywhere. Oh, oh, wait, wait, wait. There it is. 53rd. 53rd, ladies and gentlemen. But it doesn't stop there. Let me show you another thing. You'll love this. Let's direct our focus to the top 10 of this list, okay? Out of the 10 freest countries right here in the world, 1, 2, 3, 4, 5, 6, 7, 8, 8 are democratic socialist countries. But democratic socialism doesn't work.",en
../data/audios\6792348172476828934,"I'm here in Muscatine, Iowa, where Donald Trump is ready to speak at the high school gym. A very bold move for Trump, because his supporters usually avoid both education and physical fitness. Ladies babies. We are witnessing history here, folks. Specifically, Germany, 1934. We need change in the White House. We don't need some rich asshole telling us what to do. Wrong rally. We do need some rich asshole telling us what to do. You believe he's full-on conservative now? Yes. No gun control, none of that crap. Okay. Trust me, I'm from New York. Trump used to be a bigger Democratic supporter than Michael Moore's bra.",en
../data/audios\6793426109787573509,"Bro Bernie Sanders is nothing but a communist. He's trying to make this government communism. No, he's not Yes, he is. He's trying to get that free health care. That's what they do in communism. Whoa. Whoa. Whoa. Whoa. Hold up You're mixing communism and democratic socialism. There's a vast difference That's the same shit. No, it's not let me explain it to you first communism is a economic and a political Philosophy and in communism they control every aspect of everyday life needs such as housing clothing food etc where democratic socialism is an economic philosophy only and democratic socialism advocates the redistribution of wealth and power to meet public needs and not make Profits for only the top few also democratic socialism aims to weaken the power of corporations and increase the power of working people",en
../data/audios\6793721509094427910,Wait till you see the f- OOF OOF OOF OOF OOF OOF OOF OOF OOF OOF OOF OOF OOF OOF OOF,en
../data/audios\6793766811679739142,"Why don't people put American citizens first, but illegal immigrants get everything? And I hope you post this. I want this to go viral because I give a damn and I care about my community. My dad is a retired Navy captain. He served our country honorably. My grandfather is retired Navy captain and I'm doing my part to help our country because I give a damn and I'm going to fight for it. And I am 100% voting for Donald Trump on Tuesday, November 3rd, 2020. The Democrat party does not put our people first. They put sanctuary cities first. They put illegal aliens first. They tax us. They tax our water. You can't even do laundry and shower on the same day. While Nancy Pelosi is getting hundreds of thousands of dollars, robbing our pockets, not doing anything for our people, not passing legislation, passing out pens like they're candy. Meanwhile, President Trump is signing United States-Mexico-Canada agreement and he's signing trade deals and he's cutting our taxes and he's securing the border and he's putting our veterans first.",en
../data/audios\6795278985115766022,"I am so tired of that Bernie Sanders trying to give us free universal healthcare. How are we even supposed to pay for that? I don't want to be another 32 trillion dollars in debt. Plus, I'm not going to be paying for anybody's medical bills. Wait, wait, wait, wait. What? What? What did you just say? I said I'm not paying for anybody's medical bills. Go out there and get a job and pay it yourself. I gotta sit down for this. You do know that you already paid for somebody else's medical bills, right? Sure, you might be, but I'm not. Dumbass, we all are. When a person goes to the emergency room without insurance, what do you think happens to those bills? The person that went to the emergency room pays for those bills. Yeah, well, most people can't afford those bills. That means it goes to collections and their credit gets hit. And after some time, they drop off. And then your tax is paid off. And then your taxes pay for it.",en
../data/audios\6797401448968703233,बुलाती हैं मगर जाने का नहीं मेरे बेटे किसी से इश्ख कर मगर हथ से गुदर जाने का नहीं,hi
../data/audios\6797540340195806470,And all you blue-haired freaks You got way too many mental disorders Okay? And you're overweight There's only one sexuality that is correct and that's straight,en
../data/audios\6797631615511137537,Swami Vive Kamananda,en
../data/audios\6797717883922156805,"How will you convince voters that a democratic socialist can do better than President Trump with the economy? Well, you're right. The economy is doing really great for people like Mr. Bloomberg and other billionaires. In the last three years, last three years, billionaires in this country saw an $850 billion increase in their wealth. But you know what? For the ordinary American, things are not so good. Last year, real wage increases for the average worker were less than 1%. Half of our people are living paycheck to paycheck. 87 million Americans have no health insurance or are underinsured. 45 million people are struggling with student debt. 500,000 people tonight are sleeping out on the street, including 30,000 veterans. That is not an economy that's working for the American people. That's an economy working for the 1%. We're going to create an economy for all, not just wealthy campaign contributors.",en
../data/audios\6797811515782188293,It never says anything. Let's see. Keep going to the back. There we go.,en
../data/audios\6797938891652369669,"Biggest downgrades in human history? Part 4. And number 3, we got the magic school bus. Let's just say, it crashed! Number 2, Roderick turned into Lord Farquaad. And number 1, Barack Obama to Donald Trump.",en
../data/audios\6798329681771826437,"Daddy, where's that machine? Do we? It's getting rid of the moss, honey. Where's it taking them? Hell. Don't say that, Higgins. Oh, I'm sorry. Not hell. Mexico.",en
../data/audios\6798847593448344833,प्लेन जब हाथसान नदी के मिडल में क्राश किया तब इसकी रवतार लगभाग 230 किलोमेटर प्रति घंटे से भी ज्यादा थी। ये कितना खुफनाख है ये आप सोचकर ही अंदाजा लगा सकते हैं। ये मंदर और भी ज्यादा खुफनाख हो सकता था। लेकिन खुश्किस्मती के कारण ये प्लेन जब magnets प्लेन प्लेन प्लेन के लगभाग रवतार लगभाग रहे हैं।,hi
../data/audios\6799067491281800454,I gave you one of the most red pods and two mangoes and you gave me that menthol and only three of them? If anything you double up on it you dumb fuck. I gave him a banana ice puff bar so shut up. You didn't give me fucking shit.,en
../data/audios\6799102477317737733,It's just awfully good that someone with the temperament of Donald Trump is not in charge of the law in our country. Because you'd be in jail. Secretary Clinton.,en
../data/audios\6799265120112381189,"So I took a lot of shit in my other video because I said that I support Trump while I was in uniform. Well now, I'm in this uniform. Trump 2020. Let's talk this fat bitch.",en
../data/audios\6799327443711741189,"You know if Trump is bad, then so is Obama, cause he did a lot of the same things that Trump's doing. Yeah. Yeah. Yeah! It's almost like that's the f-",en
../data/audios\6800483420788116742,"You fucking moron. Who? Donald Trump. Oh yeah. Isn't he a moron? No, I love him to be honest. You do? Yeah, I voted for him. You love him? Yeah, I thought he was a better choice than Hillary. Are you for real? Yeah, no I voted for him. Do you know what he's doing now? Yeah. What? I support it. He's taking everyone's privacy. Wait, what did you say?",en
../data/audios\6801473135003831557,"This is a neighbor on my block. Total Trump supporter, total MAGA. Check out her car. Driving around. Doesn't care. Love it. Love it.",en
../data/audios\6802003835943439622,"Thank you. Thank you. Now I know we all just saw that odd clip with Joe Biden. Very weird. And this isn't the first girl Joe Biden has done this to. There Joe Biden was, swearing in a Republican senator and he just smelled the daughter's hair. What is up with this fetish? Joe Biden has a smelling hair. He also did it to former secretary of the state, Ash Carter's wife. Much it means to me to have you wear me in today. And I thank her trust and confidence. Got a lot of thanks. First rubbing on her shoulders, odd. And then just sniffed her hair. This is very odd behavior. He's making these women very uncomfortable. I got one more person for you. Coming off the plane to greet Hillary Clinton. They go in for a long hug. Now she's patting him on his arm like, yeah, all right, get off me Joe. Subtly sniffs her hair when he leans in, odd again.",en
../data/audios\6802181792771214597,"This is all Donald Trump's fault. Donald Trump is affecting global warming. Global warming is affecting the price of olives. And the price of olives are affecting olive tree's prices. Therefore, if we eliminate Donald Trump, the olive tree will give free olives. I think I just fell in love.",en
../data/audios\6803815447868247301,"Do it, do it, do it, do it. I do not understand what you guys were thinking. That was not okay to do, and for this you are going to",en
