audio_id,transcription,detected_language
../data/audios\6882184000908070149,"If you've ever wondered what people are going to write about Trump objectively in textbooks, like world history textbooks, US history textbooks, I got you because I have an edition where they have written about it. It's super funny hearing it from the point of view of like a very objective historian and they were like, Trump built this campaign based on ethnic centrism, based on fear-mongering, based on populism, and it's like just the facts. They don't mean it in like a, and you're a stupid conservative, they mean it like, they're being serious. It's just facts, that is what it was. This textbook was given to me for my American Gov and Politics class. And then it's like into Trump's first term, he starts to lose legitimacy and power and trust in the public and favorability as people start to oppose this immigration policy, there are a bunch of allegations against him and people near him go to jail, and then coronavirus. History already remembers him as a clown.",en
../data/audios\6882370173282684166,"Good morning and God bless to all my pregnant Republican women, my Trump supporters with child pro life! You're doing it! I come today with a message for your miracle, so I'll give you a second, just put your phone to your stomach. Alright, bitch, listen. I know you can control her. Make her vote for Biden! MAKE HER VOTE FOR BIDEN!",en
../data/audios\6882387340225023237,"All I know is I ain't voting for no child sniffer. Where do you guys get this? In Biden's 40 year career, there's no like news reports, formal accusations, complaints, arrests, investigations that implicate him in anything like that. What about all them picks of Biden with kids? There's plenty of awkward picks of Trump with kids too, including his daughter. What about this pick? What the hell is he doing with that boy? That's his grandson at Bo Biden's funeral, the kid's dad. It's a horrible moment of grief you guys keep using to spread lies. What about this pick of him grabbing some lady? Photoshop. Meanwhile, there's plenty of pictures of Trump with Jeffrey Epstein and his lady pimp. Oh, that's ancient history. Phone numbers for Trump were found in Jeffrey Epstein's little black book. Trump's name is also on his flight logs. What? Over 26 women have accused Trump of sexual misconduct and you want to go after Biden? That's all fake news, son.",en
../data/audios\6882414646234565894,Joe Biden did that. What did he do? He scratched the wall right here. He scratched it. What's his name? Joe Biden.,en
../data/audios\6882481400046472454,"Tell me this is not North Korea right here. Oh my god, what is this? Poor kids!",en
../data/audios\6882496874142534918,"We called and I said, Mom, you sound short of breath. She said, yeah, I'm having trouble breathing. And that's the last words I heard my mom say before she was put on a ventilator. For the entire month of May, she was fighting COVID. I said goodbye to her through FaceTime. When I had heard that President Trump had contracted COVID, I instantly thought maybe he would take it seriously. I learned so much about coronavirus. He releases a video that he's learned a lot about COVID. Don't let it dominate you. It is so disrespectful as an American who lost my mom to COVID to watch him downplay the virus. Don't be afraid of it. To see the president get top-notch medical care and not encourage a mask is heartbreaking. Don't let it take over your lives. Why didn't he listen to the medical experts from day one? He could have learned a lot about COVID then and saved over 200,000 lives. There's no excuse for it.",en
../data/audios\6882514169434803461,"So, can I help you? I actually want to talk to you. This is Elva. I want to show you something. I'm sorry, I can't come to the door right now. Get out your neighborhood bylaws. It's section 5.20. No sign shall be in the yard. If you don't take this Harris-Biden shit down, I will sue you. And I was going to have you sell my house, but that's not going to happen now, and you're going to lose a lot of business because of this crap. You get out your neighborhood association bylaws. Section 5.20.",en
../data/audios\6882834761216281862,hoping that chrissey teigen and john legend will reevaluate their thoughts on abortion wait what? chrissey teigen and john legend had a miscarriage so what's he saying here? he's basically saying you see how much you wanted to have that baby? you see how bad it hurts that you couldn't? imagine if you chose not to. what a dickhead,en
../data/audios\6882840474885901574,"If you're seeing this, the For You page thinks you are a Democrat. And if you're not voting for Joe Biden, you better go find the Republican video and make sure it beats this one. And if you're a Democrat, you better make sure your party wins. Yes, we're playing another game and this one is a fun little political game. We're doing cotton candy ice cream with blue sprinkles for the upcoming election. Don't forget to register to vote and still have fun. Guys, let's keep this game lighthearted and fun please. Thank you. Was your For You page correct?",en
../data/audios\6882842364080049413,"If you're seeing this video, your For You page thinks you're voting for Donald Trump. If you're not voting for Donald Trump, go find the Democrat video and make sure it beats this one. This is just a fun game about the election. Remember to go vote. We're making strawberry ice cream with red sprinkles to represent the Republican Party. This is just a fun way to get you guys involved in voting in a different way. So if you don't want to see Donald Trump win, go find the Democrat video and blow it up. Guys, let's keep this fun.",en
../data/audios\6882877201243458822,Even COVID picked Trump over Biden.,en
../data/audios\6882988012167335174,guy in the fucking room who's just slightly still trying to come. He's like edging slightly. Like if he says 12 2020 one more time he actually does wind up coming. It's kind of excited. It's the only way he can get off now. It's not even his wife is like do we have to watch every fucking rally that he does in order for you to get an erection? This is so weird. I don't understand why that's so weird.,en
../data/audios\6883172919615311110,"Early voting has started in Georgia. Let's see how that's going. Did you catch that 11 hours to vote in the United States of America? Let's use plain English and call it what it is. Voter suppression. Hmm, less than ideal. Let's see what Texas is up to. Texas Governor Greg Abbott today signed a new order limiting the number of designated drop-off sites in each county to a single location. But one box per county would mean Houston's Harris County would have one box for four and a half million people. Meanwhile Denver, Colorado has one box for every 20,000 people. But both parties are the same, right? Let's check in on California. Ordering the state's Republican Party to remove unofficial ballot boxes. The drop boxes have been popping up across the state. But are they legal? Spoiler alert, no. It looks to me like a rigged election. I completely agree, but it's still not gonna save you.",en
../data/audios\6883260803751906566,"Dobie, guess what? We went to vote today and guess what? We voted for Biden. I'm kidding, we didn't. We voted for Trump.",en
../data/audios\6883286482275142914,"¿Qué pasaría con México si Joe Biden gana la presidencia? Biden aseguró que la seguridad de la frontera será de forma más humana y puede que ya no exista ningún muro. Aunque es contradictorio porque cuando fue vicepresidente apoyó la construcción de una barrera entre México y Estados Unidos. Algo bueno es que los Dreamers podrán continuar con sus vidas sin ser deportados. También terminaría con las políticas de asilo de Trump y los refugiados serían tratados justamente y con dignidad. Y México no sería tercer país seguro, evitando una crisis humanitaria. En lo económico habría un problema por las políticas de AMLO. En el tema energético, AMLO no le interesan las energías alternativas e incluso insiste en construir una refinería. Por el contrario, Joe Biden dará dos billones de dólares para apoyar energías limpias y se reintegrará a los acuerdos de París. Y eso probablemente provocaría más perdidas para Pemex. Respecto al TEMEX no habría modificaciones. Ahora, si Biden gana el peso mexicano podría beneficiarse porque supuestamente trataría mejor a México. Y a México le suele ir bien cuando el presidente de Estados Unidos es demócrata.",es
../data/audios\6883314604278123781,"want. Rural America spoke up when they elected Trump. Rural America. And by rural America, he means white America. We're staring down the barrel of a gun here in white America. There's still 193 million white Americans. Yes, the vast majority of them are in their 60s and 70s, will be in the ground in the next 20 years. And therefore, we have the possibility of becoming a minority in our own country. A possibility. It sounds to me. Of becoming a minority in our own country. Like you're afraid of being me. And being This is my country is great. This is also my country. You guys didn't win the culture war. He invited us on his property to talk. But when he doesn't like our conversation, he explodes. Get the f*** out of here. We do.",en
../data/audios\6883551124494814469,They say these parties are recorded. Shit. I can't wait to blow the White House up.,en
../data/audios\6883637079125921029,"Bro, I just opened the door and this is what I see. Where did you even get these from? The church. Why did you do this? Because we're gonna redo it to trump the penis and put them back. Oh my.",en
../data/audios\6883676816578514181,"I'd like to ask myself, if I didn't just ask you, before I let you go, if you noticed the fly on Vice President Pence's head at the time during the debate, or if that was something that only, we could see it at home, could you see it sitting next to him? Did you have feelings about, like did you have the instinct to? I just, you know, I think that it's important that we kind of find a way for all of us to move on and, you know, kind of fly away from this subject.",en
../data/audios\6883678085271620869,"I just realized that I would kick myself if I didn't just ask you before I let you go if you noticed the fly on Vice President Pence's head at the time during the debate. Alright, Joel. Or if that was something that only... We could see it at home. Could you see it sitting next to him? Did you have feelings about, like, did you have the instinct to... I just, you know, I think that it's important that we kind of find a way for all of us to move on and, you know, kind of fly away from this subject onto something else.",en
../data/audios\6883684367630126342,I don't know if you guys saw yesterday Amy Coney Barrett held up a notepad and it had no notes on it and all the Republicans were so excited over this. I really don't know what kind of notes you're supposed to bring to one of these But I think bringing some notes would help prevent things like this What are the five freedoms of the First Amendment? Speech religion press assembly Speech press religion assembly I don't know what am I missing? Redress or protest Okay Her job is literally to interpret the Constitution and she can't even list off what the First Amendment does Like I that's insane It's also literally a citizenship question If you are trying to immigrate into the United States and get American citizenship You need to know the answer to this question the question that the Supreme Court Justice nominee did not know the answer to,en
../data/audios\6883693959051250949,Tududu-tududu-tudu-tudu-tudu-tudu-tudu...,en
../data/audios\6883847932437597445,"Now I'm a professional athlete, I've been one for most of my life so I've always seen things through a sports lens That makes Donald Trump our head coach And before the global pandemic we were winning Super Bowls And when you're winning Super Bowls you don't fire the coach You don't, doesn't matter if you don't like the plays he runs The players he puts on the field or what he says on Twitter You sure as hell don't replace him for another coach That's been in the business for 47 years at every level and never won a fucking game YES!",en
../data/audios\6883883286154808582,"So just do this dance as you're watching it, okay? Yeah.",en
../data/audios\6883890847713086726,My girlfriend said she'd leave me if I didn't support Trump. I said bye then,en
../data/audios\6883894441027980549,"Ready to stress about electoral college? Okay, so everybody's saying Biden's gonna win a landslide. They already have it marked as 290 to 163, like it's just a guarantee. It's not. This is including Wisconsin, Michigan, Pennsylvania, and Arizona, which Trump won in 2016. Let's take those down. Let's also take this congressional district in Nebraska away because Trump also won that. Let's just take those out and let's look at the new updated score. That would make 232 to 163 a little closer, probably more likely. So let's just leave all those as swing states for now and notice that all the things in yellow, Trump won in 2016. We have to keep that in mind. So if we start giving him some of these wins because he's probably gonna get it, let's give him Ohio, let's give him Georgia, let's give him Florida, let's give him North Carolina, and let's give him the great old state of Iowa, and that puts him ahead 247 to 232. Now we have four states left all again won by Trump in 2016. We have to keep that in mind. Let's go ahead and give him Pennsylvania. Let's hope, but we'll see. So that also puts him high three points away from the win. That's terrifying. So we have these three states left and these congressional districts.",en
../data/audios\6883895900784151814,"Hi, are you stressing? Okay, part two. So Trump is getting ahead. I'm getting nervous. But if we give Wisconsin and we give the great state of Michigan, love you guys in Wisconsin, love your cheese. I'm an Ohio state fan, but come on Michigan. And then hi, if we give Arizona, love your energy this year. Come on, Mark Kelly. If we give all those to Biden, that gives him 269, one point away. Now, how does he win, you ask? So this congressional district in Maine and this congressional district in Nebraska, kind of swing districts. The one in Maine, pretty rural, probably going to go to Trump, 268. But the one in Nebraska is basically Omaha. It is a blue city. It has voted democratic in the past. Although it did go to Trump in 2016, it is a swing district and up for grabs. So if we get this one congressional point, this one electoral college point to Trump, we have a 269 to 269 electoral college tie sends us into madness. But if we give this one electoral college point to Joe Biden, we have a Joe Biden presidency. We save our democracy. So good people of Omaha, I ask you, I ask you, I beg you, do you want to be the cause of an electoral college tie and madness? Or would you like to give the presidency to Joe Biden and save our democracy? Hi, vote blue to Omaha, vote blue Omaha.",en
../data/audios\6883898200663624965,It better fucking go that way. As soon as it's gonna take off and make a loud noise I'm gonna drop phone. You retarded? This motherfucker's retarded!,en
../data/audios\6883900883168431365,"A sixth grade teacher asked your class the other day how many of them were Trump fans. And most of them not knowing what a Trump fan was and of course wanting to be liked by their teacher, they all raised their hands. Well, all except for little Johnny. The teacher looks over at little Johnny and says, Johnny, why are you being different again? And he says, well, because I'm not a Trump fan. And she says, well, why are you not a Trump fan? And he says, because I'm a Democrat. She says, really, why are you a Democrat? He says, well, my mom's a Democrat and my dad's a Democrat. So I'm a Democrat. She says, oh, really? Well, what if your mom was a moron and your dad was an idiot? What would that make you? Johnny smiles and says, a Trump fan.",en
../data/audios\6883986886868667653,"Oh, do a flip!",en
../data/audios\6883987593856437509,"people because they use things like racism. Can I give an example? The other day, Michelle Obama went on TV. She gave a whole speech, talked about how Trump was this and Trump was that. And at the very end of what she said, she made sure to say, and yes, it is racist. You know why? Because the minute you call anything racist or you add race into it, black people get emotional and they come out. Kamala did the same thing because they know how to bait black people in. The problem is black people are stuck looking at CNN and the rest of that stuff. And here's my thing. And I've told black people this before who are Democrat. I don't try to convince Democrats to be Republican. What I try to convince them to do is know your history and read a little bit. Do your research. If you still want to vote Democrat, do what you do. But being informed, being educated and an informed voter, most Democrats can't tell you why they Democrats. They just hate Donald Trump. They can't even tell you what Biden did in 47 years, but they're going to vote for him. Couldn't have said it better myself. Trump 2020.",en
../data/audios\6884001836903189766,"What it would look like if the 2020 presidential candidates swapped genders. Donald Trump, the vice principal of a Connecticut boarding school named Mary Beth who got fired for having an affair with a student. Joe Biden, the highly overqualified moderator of a sports debate talk show. Big Daddy Pence, the mother of a missing child who hasn't been seen for a week and is now making national headlines. Kamala Harris, a blood spatter analyst for the FBI who has an interest in erotic novels. Melania Trump, a sex robot designed in Slovenia in order to infiltrate the hearts of Americans before systematically eliminating all of them.",en
../data/audios\6884002655786634502,"So I just got done voting. Let's turn Texas blue. Finally got to it at University of Houston in Clear Lake, Texas. But I went to the Civic Center in Clear Lake, Texas first. All polling places are supposed to close at 7 p.m. All of them, okay? I walked into the Civic Center and there's this woman there that just looked me up and down. I have blue hair and I'm wearing a mask. Obviously a fucking liberal. So this woman, she goes, oh, we close at five. I was like, that's funny because everyone's supposed to close at seven, right? She goes, no, no, we close at five. I said, this is my only day off that I can possibly do this. Are there any other places around that are open until seven? She goes, no, everyone else around here is also closed at five. I'm like, that just doesn't sound right. So anyway, I left freaking out thinking I'm not going to be able to vote. Someone calls me and says University of Houston, Clear Lake is open. So I went there, found out that the Civic Center voting was right in the wrong building. She lied to me. Photo suppression is fucking real.",en
../data/audios\6884009467181092102,"Mr. Vice President, I'm speaking. I'm speaking.",en
../data/audios\6884018669106498821,"If you could text Trump or Instagram him, what would you say to him? Uh, I hate him. I just hate him.",en
../data/audios\6884031299292613893,"Okay, does Joe Biden have a brother? I am lucky I have two younger brothers. I'm the oldest of three and I've got a sister who's the love of my life.",en
../data/audios\6884069429479623942,"You're gonna vote for him right? No, I don't have to. Yup, you don't have to. He doesn't need your vote. I'm not voting for anybody. I don't have to. Yup. He doesn't need your vote because... Yup! You know he's gonna win. Trump's number one. Yup.",en
../data/audios\6884294556003699973,"Now I'm a professional athlete and I've been one for most of my life so I've always seen things through a sports lens. That makes Donald Trump our head coach and before the global pandemic we were winning Super Bowls. And when you're winning Super Bowls you don't fire the coach. It doesn't matter if you don't like the plays he runs, the players he puts on the field or what he says on Twitter. You sure as hell don't replace him for another coach that's been in the business for 47 years at every level and never won a fucking game.",en
../data/audios\6884321922511932677,"I denounce white supremacy, okay? I denounced white supremacy for years. But you always do it. You always thought of it. You didn't ask Joe Biden whether or not he denounces Antifa. I watched him on the same basic show with Lester Holt, and he was asking questions like Biden was a child. Well, so this is a moment of a dodge. Are you listening? I denounce white supremacy. What's your next question? Do you feel, it feels sometimes you're hesitant to do so. Like you wait to be. Here we go again. Every time, in fact, when people came, I'm sure they'll ask you the white supremacy question. I denounce white supremacy. And frankly, you want to know something? I denounce Antifa, and I denounce these people on the left that are burning down our cities that are run by Democrats who don't know what they're doing. Is that good enough for you, Lips? No, of course not, because you've asked him a million times and you'll ask him a million more times, and it's no matter how many times he says it, it'll still never be good enough for you. You don't care if he's a racist, and you don't care about black lives.",en
../data/audios\6884335933110471942,"Audience said, why should black people vote for you? Joe Biden said, are you familiar with the term billions? I said, businesses, you'll get billions. Black colleges, you'll get billions. Chokeholds, I'll ban them. Social workers, I'll have them. De-escalation tactics, I'll mandate them. Next motherfucking question. Audience said, what you finna do with these transphobic laws instituted by the Trump administration? Biden said, I'll change the laws. What's the confusion? Next motherfucking question. Audience said, why are you eliminating tax cuts that could help working class people? He said, no, no, no, baby, you're confused. Baby, I'm not eliminating tax cuts for the working class. I'm eliminating tax cuts for people like Jeff Bezos and them down to the Amazon. Next motherfucking question. Baby, Joe Biden came in that town hall and said, try Jesus, not me.",en
../data/audios\6884339384955456773,"My youngest daughter is transgender. The Trump administration has attacked the rights of transgender people, banning them from military service, weakening non-discrimination protections, and even removing the word transgender from some government websites. How will you, as president, reverse this dangerous and discriminatory agenda and ensure that the lives and rights of LGBTQ people are protected under U.S. law? I will flat out just change the law, eliminate those.",en
../data/audios\6884656857638505733,"Mi nombre es Eddie, pero el día de hoy no seré Eddie, seré... The USAGEN Border Patrol Air-Rex Tenerheiro. Stop resisting! Stop resisting!",es
../data/audios\6884683028552092933,"Please don't throw me in the water again. Please don't please don't. Okay. Thank you All right, just lay me down here on the grass next to this. What are you doing with that tractor though? Can you not can you turn that tractor up and please don't run me over?",en
../data/audios\6884720386806779142,"So if we're ever talking and you pull out the infamous like all of my exes were crazy card like I'm gonna hear you out. I'm gonna ask why I'm gonna listen. But see the thing is I know what that means I'm not stupid. So then we're gonna get into a relationship, you know, and I'm gonna be perfect I'm gonna be chill. You want to go hang with your homegirls? Do it You want to have female friends? I don't care. Have fun But while you're falling in love with me, okay, because I'm so chill and I'm so accepting I'm gonna take every ounce of psychological torture that you put those crazy exes through and I'ma turn around on you buddy Because there's nothing funnier than watching a narcissist Sit there and cry and beg me to let him go through my phone because he doesn't trust that I don't have other guys Like I'm not crazy. I'm karma But who's crazy now?",en
../data/audios\6884746216341589253,"Sorry, we're gonna need that. Wait, our election's gonna need those. Not my fault. It's a stamp of approval. You know you can't win, so you made us your scapegoat. No, I hate fraud! No fake news, no fake votes! Two depression and World Wars always deliver was the policy. Even in a pandemic, we stand committed to democracy. But someone could die and vote two times after. You wanna defund mailmen? I thought to choose the voters. The voters choose you. Cheated your taxes, your wife, your SATs are in question, but let's get one thing straight. You can't cheat the election. For 150 years, we've been picking up the votes, so when you lose, I'll be there to deliver the results. Uh-uh. Speaking of... Positive?",en
../data/audios\6884846532110060805,I defund the police because my dad's a police officer and he almost died last week because stupid protesters like you guys defund all police Oh yeah? Cause they were for a corrupt system Oh yeah oh yeah that's why you look like a freaking vampire Hey you little Don't be a snowflake No no no Don't be a snowflake Use facts not feelings I don't want anecdotal evidence about your life stories I want actual facts and statistics not feelings Okay I will tell you about my facts and you She's mad Stop telling me about your feelings because all liberals do is talk about their feelings and not facts on Trump Yeah yeah And all of- really how do you realize no one has- I don't post black squares and I do have a lot of policy reasons why I don't support Trump and why I support Biden,en
